number,identifier,category,rationale
702,RHC,Technical/Professional - Independent RHC,Technical components are billed to Medicare Part B on a 1500 claim form with modifier TC and place of service 72. The professional component should be billed with a qualifying visit with modifier 26.
703,RHC,Technical/Professional - Independent RHC,Technical components are billed to Medicare Part B on a 1500 claim form with modifier TC. The professional component should be billed with a qualifying visit with modifier 26.
704,UNVSL,Physician billing - Professional/Technical Component,Review physician billing of a global code outside of an office setting. The professional component may need to be billed with modifier 26.
705,ICD:CM,Z34 Encounter for supervision of normal pregnancy,"Encounter for supervision of normal pregnancy (Z34) should not be reported with any complication of pregnancy (O00-O9A), encounter for pregnancy test (Z32.0-), or encounter for supervision of high risk pregnancy (O09.-)."
706,ICD:CM,Z3A Weeks of Gestation,"Weeks of gestation (Z3A): Code first complications of pregnancy, childbirth and the puerperium (O09-O9A). Z3A is not a valid primary dx."
707,ICD:CM,Age - Pregnancy,Review the ICD-10 coding versus the age of the patient. Supervision of elderly primigravida and multigravida is the supervision of pregnancy for a female 35 years and older at expected date of delivery.
708,ICD:CM,Age - Pregnancy,Review the ICD-10 coding versus the age of the patient. Supervision of pregnancy for a female 35 years and older at expected date of delivery is considered high risk. Z34 may not be appropriate.
709,ICD:CM,Age - Pregnancy,Review the ICD-10 coding versus the age of the patient. Supervision of pregnancy for a female less than 16 years old at expected date of delivery is considered high risk. Z34 may not be appropriate.
710,OBGYN,Global visits,"Review payer guidelines for antepartum care. Depending on the total number of patient encounters, most payers require global obstetric codes to be reported. For one to three antepartum care visits, see the appropriate E/M code. 59425 includes four to six visits. 59426 covers seven or more visits."
711,OBGYN,NA,Add reporting codes for prenatal visits for tracking purposes. 0500F: Initial prenatal care visit or 0502F: Subsequent prenatal care visit.
712,OBGYN,Complication visits,"Services unrelated to pregnancy but performed by the provider rendering global maternity care should be documented and reported separately with the appropriate inpatient or outpatient Evaluation and Management code, using the condition unrelated to pregnancy as the primary diagnosis code. Z34 should not be pointed to the E&M code, but may be pointed to pregnancy related services performed during the visit. If other services are not reported, remove Z34 from the claim."
713,OBGYN,0500F,"0500F: Initial prenatal care visit (report at first prenatal encounter with health care professional providing obstetrical care. Report also date of visit and, in a separate field, the date of the last menstrual period [LMP])"
714,OBGYN,0500F,Add visit information to the RCM OBGYN Prenatal Visit Tracking spreadsheet.
715,OBGYN,0501F,"0501F: Report also: date of visit and, in a separate field, the date of the last menstrual period [LMP]"
716,OBGYN,Prenatal reporting,"If reporting 0501F Prenatal flow sheet, it is not necessary to report 0500F Initial prenatal care visit."
717,OBGYN,0502F,"Subsequent prenatal care visit (0502F) Excludes: patients who are seen for a condition unrelated to pregnancy or prenatal care (eg, an upper respiratory infection, patients seen for consultation only, not for continuing care)"
718,OBGYN,Medical Visits,"If the patient has a complication or requires additional workup or care, coders should assign the appropriate E/M code (i.e., 99212–99215) to reflect the separately identifiable service. The diagnosis should also reflect the separately identifiable service."
719,OBGYN,0503F,"Postpartum care visit (0503F) Excludes: patients who are seen for a condition unrelated to routine uncomplicated postpartum care. The visit should be reported separately with the appropriate inpatient or outpatient Evaluation and Management code, using the condition unrelated to routine postpartum care as the primary diagnosis code."
720,OBGYN,NA,Review United Healthcare payer guidelines. ICD-10-CM diagnosis codes listed identify complications or high risk conditions.
721,RADIO,Age Restriction,73592 should only be used for patients under 1 year of age. Review for correct CPT.
722,OBGYN,NA,Review Anthem BCBS Payer Guidelines. Additional office visits are eligible for separate reimbursement for any unrelated condition and when the E/M is reported with a diagnosis code not related to a normal pregnancy diagnosis.
723,OBGYN,NA,Review Anthem BCBS Payer Guidelines. The Health Plan defines normal pregnancy by one or more ICD-10 codes on the claim. Review guidelines if billing E/M codes outside of global codes. Remove normal supervision codes when billing E/M visits for any unrelated condition and when the E/M is reported with a diagnosis code not related to a normal pregnancy diagnosis.
724,OBGYN,NA,Review Anthem BCBS Payer Guidelines. Medical problems complicating labor and delivery management may require additional resources and should be identified by utilizing the appropriate CPT codes in the Medicine and Evaluation and Management Services section of the CPT manual in addition to codes for maternity care.
725,OBGYN,NA,"Most Anthem policies consider all E/M visits with a normal pregnancy, supervision of pregnancy and/or normal delivery dx assigned, to be included in the global obstetric services and not separately payable. Make sure none of these codes are assigned to the E/M or billed as primary. Task office for additional dx if no other codes are on claim. (Supervison of pregnancy/normal pregnancy dx codes are ok to assign to the ultrasound charge, when performed.)"
726,MCD:GA,NA,Providers must use one of the following ICD-10 diagnosis codes when billing the preventive health visit code: Z00.00 or Z00.01 (Encounter for adult examination).
727,ICD:CM,Age - Maternity 9-64 years (Physician),The diagnosis is inconsistent with the patients age. One or more maternity ICD-10 codes are only appropriate for ages 9-64 years and should only be on mothers claim.
728,ICD:CM,L50 Excludes 1,"L50 Urticaria and allergic contact dermatitis (L23-L23.9), angioneurotic edema (T78.3-T78.3XXS), giant urticaria (T78.3-T78.3XXS), hereditary angio-edema (D84.1), Quinckes edema (T78.3-T78.3XXS), serum urticaria (T80.6-T80.69XS), solar urticaria (L56.3), urticaria neonatorum (P83.8), urticaria papulosa (L28.2), and urticaria pigmentosa (D47.01) identify conditions that cannot be reported together except when the two conditions are unrelated per the ICD-10-CM Excludes1 note guideline."
730,VAX,90471 warning,Review units on 90471. Report 90471 for one vaccine and 90472 for each additional vaccine (single or combination vaccine/toxoid).
731,VAX,90473 warning,Review units on 90473. Report 90473 for one vaccine and 90474 for each additional vaccine (single or combination vaccine/toxoid).
732,MCD:SC,NA,"Effective April 1, 2021, the integration of Absolute Total Care and WellCare is complete. Do not file claims with a date of service on or after 04/01/2021 to Wellcare (14163). All Wellcare claims should be billed to Absolute Total Care (68069)."
733,UNVSL,NA,Update the encounter bill type to self-pay for custom codes billed and paid by the patient.
734,UNVSL,Missing IV admin,Review for missing IV infusion code 9636X
735,MCD:MD,NA,Report the appropriate vaccine product CPT code(s) with the SE modifier appended to each code with an established fee.
736,MCD:MD,NA,Do NOT bill a separate CPT vaccine administration code to Medicaid/Medicaid MCO.
737,ICD:CM,R19.4 Excludes 1 with K59.0-K59.09 and K59.1,"R19.4 should not be billed with K59.0-K59.09, K59.1"
738,VAX,NA,"Report codes 90471-90474 for immunization administration of any vaccine that is not accompanied by face-to-face physician or other qualified health care professional counseling the patient and/or family, or for patients over 18 years of age."
739,VAX,NA,Oral vaccines are reported with 90473-90474.
740,VAX,NA,Intranasal vaccines are reported with 90473-90474.
741,INTEG,NA,"Review Coding for Mycotic Nails: Claim should be coded with ICD-10 code B35.1 as a primary code AND L02.611- L02.612, L03.031-L03.032, L03.041-L03.042, M79.671- M79.672, M79.674-M79.675 or R26.2 as a secondary code. Systemic condition modifiers are not necessary for services performed for this indication with these diagnosis codes."
742,INTEG,NA,Review Coding for Systemic Conditions: Routine procedures are covered only if the patient is under the active care of a doctor of medicine or osteopathy or NPP who documents the condition. This provider must be added as the referring provider. The date the patient was last seen by the referring provider should be billed in the Reserved for Local Use box.
743,MEDSV,POS reminder,Review CPT versus place of service. 94002-94003 should be billed in an hospital inpatient/outpatient place of service only.
744,E&M,99202-99215 POS,Review CPT vs place of service. Office or other outpatient visit (99202-99215) should be billed with an outpatient place of service.
745,MCD:CO,NA,Long-acting reversible contraceptive devices can be billed on the CMS 1500 claim form using the appropriate HCPCS codes for the devices and modifier FP.
746,MCD:CO,NA,RHCs that submit a UB-04 must have at least one (1) claim line that identifies revenue code 0521 for RHCs. All other lines on the claim should have the revenue code most appropriate for the service. The line item with revenue code 0521 can appear at any line on the claim and with any procedure code.
747,MCD:CO,NA,RHCs can serve as an originating site allowing a member to connect with a distant provider that is not affiliated with the originating site. The service must be submitted on a 1500 claim form.
748,MCD:CO,NA,Behavioral health claims should be billed on a UB with revenue code 900. Assign appropriate behavioral health dx.
749,MCD:CO,NA,A valid national drug code (NDC) number must be included on all claims and encounters for physician-administered drugs.
750,MCD:CO,NA,Voluntary sterilization is considered a family planning service (requiring the FP modifier with billing). A copy of the CO Medicaid sterilization consent form (MED 178) must be attached to each related claim.
751,MCD:CO,NA,Rural Health Clinics (RHCs) complete the UB-04 claim form for EPSDT-rendered services.
752,MCD:CO,NA,A valid national drug code (NDC) number must be included on all claims for vaccine product codes.
753,MCD:CO,NA,"RHCs may bill an encounter fee even if the only service provided is administering an immunization by a billable provider (MD, PA, NP). Update the revenue code of the administration code to 0521."
754,MCD:CO,NA,"Claims must be submitted with the accurately completed required documentation identifying the affiliated condition associated with the pregnancy. Use modifier G7 - Termination of pregnancy resulting from rape, incest, or certified by physician as life-threatening on abortion codes."
755,MCD:CO,NA,"When billing for family planning services, such as for contraception provision or sterilization procedures, always include the family planning (FP) modifier next to the appropriate procedure code on claims."
756,MCD:CO,NA,"If 3 or fewer antepartum visits are performed or billing outside of the global reimbursement due to unusual circumstances or complications, the appropriate E/M visit code should be billed, with the TH modifier appended to indicate that the visit is pregnancy-related but outside of the OB global billing code."
757,MCD:CO,NA,"Billing for Multiple Infants: Include modifier 59 in the first position for Baby B. Use the delivery date as the date of service. A second modifier XU is required for NCCI edits when the following code combinations are billed: 59410 with 59409, 59610 with 59612 or 59614 with 59612."
758,MCD:CO,NA,"NCCI edits do not allow procedure code 59514 to be combined or billed with codes: 59400, 59409 or 59410."
759,MCD:CO,NA,"If surgical procedures are unilateral (not bilateral) and surgery does not result in sterilization, utilize the appropriate right (RT) or left (LT) modifier with the procedure code on claims. When the unilateral procedure does not lead to complete sterilization, the Med 178 Sterilization Consent Form is not required."
760,BCBS:GA,NA,Providers who have obtained a CLIA Waiver or Provider Performed Microscopy Procedure accreditation must include the “QW” modifier when any CLIA Waived laboratory service is reported on a CMS-1500 claim form in order for the procedure to be evaluated to determine eligibility for benefit coverage.
761,MCD:GA,NA,Providers who have obtained a CLIA Waiver or Provider Performed Microscopy Procedure accreditation must include the QW modifier when any CLIA waived laboratory service is reported on a CMS-1500 claim form in order for the procedure to be evaluated to determine eligibility for benefit coverage.
762,VFC:CO,NA,The maximum fees that providers may charge for the administration of pediatric vaccines to uninsured children under the Vaccines for Children (VFC) program is $21.68 per dose. Serum codes should be reported as $0.00 if present.
764,VFC:MI,NA,The maximum fees that providers may charge for the administration of pediatric vaccines to uninsured children under the Vaccines for Children (VFC) program is $23.03 per dose. Serum codes should be reported as $0.00 if present.
765,VAX,NA,"All organizations and providers participating in the CDC COVID-19 Vaccination Program must administer COVID-19 Vaccine at no out-of-pocket cost to the recipient. Review balance as providers may not seek any reimbursement, including through balance billing, from the vaccine recipient UNLESS vaccine was purchased by office. As of 09/11/2023 the CDC COVID-19 Vaccination Program has been discontinued"
766,MCD:MI,NA,Providers who bill physician administered drugs (injectable and non-injectable) separately to Medicaid must report the National Drug Code (NDC) and its supplemental information in addition to the corresponding procedure code (CPT or HCPCS) to assist Medicaid in collecting rebates.
767,MCD:MI,NA,"Therapy services must be reported using the appropriate therapy modifier to distinguish the discipline under which the service is delivered. In addition, when services are habilitative, they must be reported with the appropriate modifier that represents the nature of the therapy. Maintenance therapy visits should also include the MDHHS designated maintenance modifier."
768,MCD:MI,NA,Immunizations included in the Vaccine For Children (VFC) Program are free to providers so the charge for these vaccines must be reported as $0.00 (zero dollars).
769,MCD:MI,NA,All clinical lab services billed to Medicaid must have a referring/ordering Medicaid provider name and NPI.
770,MCD:MI,NA,"If bilateral x-rays are performed on extremities, report on two service lines with modifier RT on one and modifier LT on the other."
771,MCD:MI,NA,Diagnostic radiology services that are a result of a physician’s order or referral require the submission of the referring/ordering Medicaid provider name and NPI.
772,MCD:MI,NA,"When billing Medicaid for services rendered, providers performing tests that use waived methodologies must enter the QW modifier with the appropriate Current Procedural Terminology (CPT) code to denote the waived test."
773,MCD:MI,NA,"For services provided through telepractice, each procedure code must include the modifier GT."
774,ICD:CM,NA,Encounter for screening for other suspected endocrine disorder (Z13.29) should not be reported with encounter for screening for diabetes mellitus (Z13.1) except when the two conditions are unrelated per the ICD-10-CM Excludes 1 guideline.
775,MCD:MI,NA,"A preventive medicine E/M visit and another E/M visit on the same date are billed separately if, during the preventive visit, a problem or abnormality is detected which requires additional work which meets the key component requirements of a problemoriented E/M visit. When this occurs, bill the office/outpatient E/M procedure code using modifier 25 and bill the preventive E/M visit without using a modifier. Refer to CPT guidelines for additional information."
776,GASTRO,NA,"To report screening colonoscopy on a patient not considered high risk for colorectal cancer, use HCPCS code G0121 and diagnosis code Z12.11 (encounter for screening for malignant neoplasm of the colon). To report screening on a Medicare beneficiary at high risk for colorectal cancer, use HCPCS G0105 and the appropriate diagnosis code that necessitates the more frequent screening."
777,ANES,NA,The Centers for Medicare & Medicaid Services (CMS) does not recognize Qualifying Circumstances for additional payment.
778,ANES,99100 Add on,99100 - Code first primary anesthesia procedure
779,ANES,99116 Add on,99116 - Code first primary anesthesia procedure
780,ANES,99135 Add on,99135 - Code first primary anesthesia procedure
781,ANES,99140 Add on,99140 - Code first primary anesthesia procedure
782,ICD:CM,J91.0 cannot be billed as primary,J91.0 cannot be used as primary dx. Code first underlying neoplasm.
783,ICD:CM,J91.8 cannot be billed as primary,J91.8 cannot be used as primary dx. Code first underlying disease.
784,ORTHO,Casting supplies,Application of the cast should be billed in addition to casting supplies unless fracture/dislocation treatment was also performed.
785,ORTHO,Splinting supplies,Application of the splint should be billed in addition to slint supplies unless fracture/dislocation treatment was also performed.
786,ASC,Facility billing - Professional/Technical Component,Review Global CPT for missing modifier. The technical component should be billed with modifier TC.
787,ICD:CM,N00-N99 - Chapter 14:Diseases of the genitourinary system,"Absent, scanty and rare menstruation (N91.-) with ovarian dysfunction (E28.-) ​identify conditions that cannot be reported together except when the two conditions are unrelated per the ICD-10-CM Excludes1 note guideline"
788,E&M,N00-N99 - Chapter 14:Diseases of the genitourinary system,"99234-99236 - Observation or inpatient hospital care, for the evaluation and management of a patient including admission and discharge on the same date. Review coding, admission and discharge codes cannot be billed with 99234-99236."
789,MEDSV,N00-N99 - Chapter 14:Diseases of the genitourinary system,"90833, 90836, 90838 require one of the following to be coded first: 99202-99255, 99304-99316 or 99341-99350"
790,MCD:CA,NA,"For bilateral procedures requiring a separate incision performed at the same operative session, providers should bill the first procedure on the first claim line with the appropriate CPT code followed by modifier AG, which indicates that the procedure is the primary surgery. Providers should bill the second procedure on the next billing line with the appropriate CPT code followed by modifier 50, which indicates the procedure was bilateral."
791,MCD:CA,NA,"Include the PA name, provider number and type of NMP-PA in the Remarks field (Box 80)/Additional Claim Information field (Box 19) of the claim (RESERVED FOR LOCAL USE). Add each individual PAs name, provider number, and type of NMP-PA to alert"
792,MCD:CA,NA,"Modifier U7 is used to denote services rendered by a PA. If multiple modifiers are used, use modifier 99. In RESERVED FOR LOCAL USE, indicate the multiple modifiers. For example, Line 4: 99 = U7 + 25"
793,MCD:CA,NA,"Modifer 99 is used when two or more modifiers are necessary to completely delineate a service, the multiple modifiers used must be explained in the RESERVED FOR LOCAL BOX box of the claim. Ex: Line 4: 99 = AG + LT"
794,ASC,NA,"Review the use of a global modifier in an ASC. The ASC’s “global period” or “postoperative period” is 24 hours from the time the surgery begins. It is not 10 or 90 days as it is for physicians. Some payors may consider the global period to be 48-72 hours for ASCs. When a physician performs a staged procedure in an ASC, it is not necessary for the coder to append modifier -58, unless it occurs during the facilitys global period, which is 24 hours."
795,ASC,NA,Modifier 53 is for professional physician services and would not apply to ASC procedures. Review modifier 73 and 74 to see which is most appropriate.
796,UNVSL,NA,"If a treating practitioner applies surgical dressings as part of a professional service that is billed to Medicare, the surgical dressings are considered incident to the professional services of the health care practitioner and are not separately payable. Claims for these dressings must not be submitted. Claims for the professional service, which includes the dressings, must be submitted to the local carrier or intermediary. If dressing changes are sent home with the beneficiary, claims for these dressings may be submitted. In this situation, use the place of service corresponding to the beneficiarys residence, Place of Service Office (POS=11) must not be used."
797,MCD:CA,NA,CPT codes 97605 thru 97606 (negative pressure wound therapy) are not Medi-Cal benefits. reimbursement for these services is included in the payment for HCPCS code E2402.
798,BCBS:MI,NA,"For BCN behavioral health services, always include licensure level (level of care) modifier (forexample: AM, HA, HO, AJ, TD, HE, AH)."
799,LABS,NA,All UHC claims must be submitted with a valid ordering or referring practitioner for clinical laboratories for ordered tests.
800,RADIO,NA,All Medicare Advantage claims must be submitted with a valid ordering or referring practitioner for imaging centers for ordered imaging procedures.
801,UNVSL,NA,All UHC claims must be submitted with a valid ordering or referring practitioner. Please add referring provider.
802,RADIO,Do not bill x-rays with modifier 50. List separate line items with RT/LT modifiers.,Do not bill x-rays with modifier 50. List separate line items with RT/LT modifiers.
803,ICD:CM,I87.2 has excludes 1 note with I83.1X-I83.2X,I87.2 cannot be billed with I83.1X-I83.2X. Remove I87.2.
804,MEDSV,POS for Home sleep study,"Place of service for G0398, G0399 and G0400 should be 12 (HOME)"
805,LABS,80048 is included in 80069,80048 is included in 80069 and cannot be billed using any modifier. The BMP includes all the same labs performed in the renal function panel. Remove 80048.
806,UNVSL,80048 is included in 80069,Accident date or onset date is required for this payer. Choose Emloyment Related or Auto Accident = Yes. Current type = Injury(Accident). And add the date of injury for Date of Current.
807,UNVSL,80048 is included in 80069,"Subscriber SSN is required when submitting Workers Compensation claim electronically. If SSN is not available, use 999-99-9999 to bypass edit."
808,LABS,Screening versus diagnostic PSA,"84153 should be used instead of G0103 when performed for a medical reason (elevated PSA, BPH, hematuria, Prostate cancer, etc). Please correct CPT."
809,UNVSL,Missing administration code,Review for possible missing drug injection administration code(s).
810,UNVSL,Missing administration code,Injection code is present without a drug. Review chart for drug used. Add drug if clinic supplied.
811,PREVENT,Medicare denial if screening dx is assigned first for 96127,Medicare will not reimburse 96127 if Z13.39 or another screening dx is assigned first. Use other dx if applicable.
812,VAX,NA,"For an encounter for antibody testing that is NOT being performed to confirm a current COVID-19 infection, NOR is a follow-up test after resolution of COVID-19, assign Z01.84, Encounter for antibody response examination."
814,VAX,NA,"For individuals who previously had COVID-19, without residual symptom(s) or condition(s), and are being seen for follow-up evaluation, and COVID-19 test results are negative, assign codes Z09, Encounter for follow-up examination after completed treatment for conditions other than malignant neoplasm, and Z86.16, Personal history of COVID-19."
815,VAX,NA,"Also assign code(s) for the specific symptoms or conditions related to the previous COVID-19 infection, if known. Code U09.9 should not be assigned for manifestations of an active (current) COVID-19 infection."
817,ICD:CM,"R00-R99 - Chapter 18: Symptoms, signs and abnormal clinical and laboratory findings, not elsewhere classified",R63.3 (Feeding difficulties) is an expired code. See R63.30 (Feeding difficulties) or R63.39 (Feeding problem (elderly)(infant).
818,VAX,NA,Add M0201 for Covid vaccine given at the patients home.
820,TELE,NA,"Review payer guidelines to determine if a telehealth modifier is appropriate for the CPT. Codes are not on approved telehealth list, but payer may have different guidelines."
821,E&M,G0425-G0427,"Review CPT vs place of service. Telehealth consultation, emergency department or initial inpatient (G0425-G0427) should be billed with an inpatient, emergency department, or telehealth place of service."
822,E&M,Emergency Department Visits,Review CPT vs place of service. Emergency department visits should be billed with an emergency department place of service.
823,ICD:CM,G50-G59 excludes 1,"M79.2, O26.82*, M54.1* should not be billed with G50*-G59*."
824,GASTRO,Modifier PT/33 with screenings,"Modifier PT/33 should not be used for G0104, G0105, G0106, G0118, G0120, G0121, G0122"
825,GASTRO,Surgical endoscopy includes diagnostic,A surgical Colonoscopy includes a diagnostic Colonoscopy (45378) and should not be billed separately.
826,GASTRO,Surgical endoscopy includes diagnostic,A surgical EGD includes a diagnostic EGD (43235) and should not be billed separately.
827,ICD:CM,NA,"R35.8 requires an additional digit. See R35.81, R35.89."
828,ICD:CM,NA,"M54.5 requires an additional digit. See M54.50, M54.51, M54.59"
